{
  "cart_id": "kQ8vZEd-UnW_gZu6c4iO",
  "items": [
    "example"
  ],
  "pickup": false,
  "driver_tip_cents": 100,
  "user_latitude": 37.7786357,
  "user_longitude": -122.3918135,
  "user_street_num": "188",
  "user_street_name": "King Street",
  "user_apt_num": "example",
  "user_city": "San Francisco",
  "user_state": "CA",
  "user_country": "US",
  "user_zipcode": "94107",
  "user_dropoff_notes": "Leave at the front desk",
  "user_name": "Steve Jobs",
  "user_email": "diner@example.com",
  "user_phone": 14155550123,
  "user_id": "user_abc123",
  "disable_sms": false,
  "customer_order_id": "id_7b2c4e",
  "autofill_selected_options": false
}